{
  "tool": "verify",
  "status": "ok",
  "summary": "PASS: 1/1 case(s) match (worst max abs err 2.38e-07, atol 1e-05)",
  "evidence": {
    "mode": "array",
    "cases": [
      {
        "input": null,
        "reference": {
          "command": "build/reference /tmp/tmp.Be0qV9dWk2/out/work/v_sycl/case0_reference.out 1048576 10 1",
          "returncode": 0,
          "duration_s": 0.354878,
          "stdout": "",
          "stderr": "",
          "cwd": "/tmp/tmp.Be0qV9dWk2/out/work",
          "env_overrides": {
            "ONEAPI_DEVICE_SELECTOR": "cuda:0"
          },
          "output_file": "/tmp/tmp.Be0qV9dWk2/out/work/v_sycl/case0_reference.out"
        },
        "candidate": {
          "command": "build/sycl /tmp/tmp.Be0qV9dWk2/out/work/v_sycl/case0_candidate.out 1048576 10 1",
          "returncode": 0,
          "duration_s": 0.403085,
          "stdout": "kernel_ms=0.381717\n",
          "stderr": "",
          "cwd": "/tmp/tmp.Be0qV9dWk2/out/work",
          "env_overrides": {
            "ONEAPI_DEVICE_SELECTOR": "cuda:0"
          },
          "output_file": "/tmp/tmp.Be0qV9dWk2/out/work/v_sycl/case0_candidate.out"
        },
        "reference_format": "f32",
        "candidate_format": "f32",
        "mode": "array",
        "stats": {
          "n_reference": 1048576,
          "n_candidate": 1048576,
          "atol": 1e-05,
          "rtol": 0.0001,
          "max_ulp_allowed": null,
          "passed": true,
          "max_abs_err": 2.384185791015625e-07,
          "rms_err": 3.0353967752667396e-09,
          "mean_abs_err": 2.0673515298345576e-10,
          "max_rel_err": 0.0005249228159780455,
          "max_ulp_f32": 4407,
          "median_ulp_f32": 0.0,
          "exact_matches": 1035581,
          "mismatches": 0,
          "nan_mismatches": 0,
          "reference_range": [
            -2.020778179168701,
            0.9949403405189514
          ],
          "first_mismatches": []
        },
        "passed": true
      }
    ],
    "work_dir": "/tmp/tmp.Be0qV9dWk2/out/work/v_sycl",
    "passed_cases": 1,
    "total_cases": 1,
    "worst_max_abs_err": 2.384185791015625e-07
  },
  "limitations": [
    "Equivalence is shown only for the inputs tested; other inputs/sizes may behave differently."
  ]
}