{
  "tool": "gpu_test",
  "status": "ok",
  "summary": "PASS on NVIDIA RTX 4000 Ada Generation (cuda:0, nvidia): sycl_verify_vs_reference: PASS: 1/1 case(s) match (worst max abs err 2.38e-07, atol 1e-05); sycl_verify_vs_native: PASS: 1/1 case(s) match (worst max abs err 5.96e-08, atol 1e-05)",
  "evidence": {
    "task": "adam_hecbench_agent",
    "device": {
      "backend": "cuda",
      "device_type": "gpu",
      "index": 0,
      "platform": "NVIDIA CUDA BACKEND",
      "name": "NVIDIA RTX 4000 Ada Generation",
      "description": "NVIDIA CUDA BACKEND, NVIDIA RTX 4000 Ada Generation 8.9 [CUDA 13.0]",
      "selector": "cuda:0"
    },
    "vendor": "nvidia",
    "amd_arch": null,
    "cuda_arch": "89",
    "target_flags": [
      "-fsycl-targets=nvidia_gpu_sm_89"
    ],
    "selector": "cuda:0",
    "steps": [
      {
        "step": "reference_build",
        "status": "ok",
        "summary": "exit 0: g++ -O2 -std=c++17 -I/tmp/tmp.Be0qV9dWk2/task /tmp/tmp.Be0qV9dWk2/task/adam_ref.cpp -o build/reference"
      },
      {
        "step": "native_build",
        "status": "ok",
        "summary": "exit 0: /usr/local/cuda/bin/nvcc -O2 -std=c++17 -arch=native -I/tmp/tmp.Be0qV9dWk2/task /tmp/tmp.Be0qV9dWk2/task/adam.cu -o build/native"
      },
      {
        "step": "native_verify_vs_reference",
        "status": "ok",
        "summary": "PASS: 1/1 case(s) match (worst max abs err 2.38e-07, atol 1e-05)"
      },
      {
        "step": "sycl_compile",
        "status": "ok",
        "summary": "compiled 1 source(s) -> /tmp/tmp.Be0qV9dWk2/out/work/build/sycl (0 warning(s))"
      },
      {
        "step": "sycl_verify_vs_reference",
        "status": "ok",
        "summary": "PASS: 1/1 case(s) match (worst max abs err 2.38e-07, atol 1e-05)"
      },
      {
        "step": "sycl_verify_vs_native",
        "status": "ok",
        "summary": "PASS: 1/1 case(s) match (worst max abs err 5.96e-08, atol 1e-05)"
      },
      {
        "step": "sycl_benchmark",
        "status": "ok",
        "summary": "10 run(s) each; cuda:0: median 357.25 ms, p95 377.02 ms"
      },
      {
        "step": "native_benchmark",
        "status": "ok",
        "summary": "10 run(s) each; none: median 341.71 ms, p95 389.84 ms"
      }
    ],
    "results_dir": "/tmp/tmp.Be0qV9dWk2/out/results"
  },
  "limitations": [
    "Benchmarks are single-process wall times plus program-reported kernel times; treat them as rough."
  ]
}