{
  "tool": "verify",
  "status": "ok",
  "summary": "PASS: 1/1 case(s) match (worst max abs err 9.69e-08, atol 1e-06)",
  "evidence": {
    "mode": "array",
    "cases": [
      {
        "input": null,
        "reference": {
          "command": "build/reference /tmp/tmp.dmg4H65GoV/out/work/v_sycl/case0_reference.out 2048 256",
          "returncode": 0,
          "duration_s": 0.009247,
          "stdout": "",
          "stderr": "",
          "cwd": "/tmp/tmp.dmg4H65GoV/out/work",
          "env_overrides": {
            "ONEAPI_DEVICE_SELECTOR": "cuda:0"
          },
          "output_file": "/tmp/tmp.dmg4H65GoV/out/work/v_sycl/case0_reference.out"
        },
        "candidate": {
          "command": "build/sycl /tmp/tmp.dmg4H65GoV/out/work/v_sycl/case0_candidate.out 2048 256",
          "returncode": 0,
          "duration_s": 0.229652,
          "stdout": "kernel_ms=0.327732\n",
          "stderr": "",
          "cwd": "/tmp/tmp.dmg4H65GoV/out/work",
          "env_overrides": {
            "ONEAPI_DEVICE_SELECTOR": "cuda:0"
          },
          "output_file": "/tmp/tmp.dmg4H65GoV/out/work/v_sycl/case0_candidate.out"
        },
        "reference_format": "f32",
        "candidate_format": "f32",
        "mode": "array",
        "stats": {
          "n_reference": 524288,
          "n_candidate": 524288,
          "atol": 1e-06,
          "rtol": 0.0,
          "max_ulp_allowed": null,
          "passed": true,
          "max_abs_err": 9.685754776000977e-08,
          "rms_err": 1.2156073686116308e-08,
          "mean_abs_err": 4.56334170250523e-09,
          "max_rel_err": 2.5387742880076123e-06,
          "max_ulp_f32": 40,
          "median_ulp_f32": 14.0,
          "exact_matches": 4789,
          "mismatches": 0,
          "nan_mismatches": 0,
          "reference_range": [
            1.2936880011693574e-07,
            0.056325364857912064
          ],
          "first_mismatches": []
        },
        "passed": true
      }
    ],
    "work_dir": "/tmp/tmp.dmg4H65GoV/out/work/v_sycl",
    "passed_cases": 1,
    "total_cases": 1,
    "worst_max_abs_err": 9.685754776000977e-08
  },
  "limitations": [
    "Equivalence is shown only for the inputs tested; other inputs/sizes may behave differently."
  ]
}