{
  "tool": "gpu_test",
  "status": "ok",
  "summary": "PASS on gfx950:sramecc+:xnack- gfx950:sramecc+:xnack- [HIP 70051.83] (hip:0, amd): sycl_verify_vs_reference: PASS: 1/1 case(s) match (worst max abs err 0, atol 0); sycl_verify_vs_native: PASS: 1/1 case(s) match (worst max abs err 0, atol 0)",
  "evidence": {
    "task": "scan_hecbench_agent",
    "device": {
      "backend": "hip",
      "device_type": "gpu",
      "index": 0,
      "platform": "AMD HIP BACKEND",
      "name": "gfx950:sramecc+:xnack- gfx950:sramecc+:xnack- [HIP 70051.83]",
      "description": "AMD HIP BACKEND, gfx950:sramecc+:xnack- gfx950:sramecc+:xnack- [HIP 70051.83]",
      "selector": "hip:0"
    },
    "vendor": "amd",
    "amd_arch": "gfx950",
    "cuda_arch": null,
    "target_flags": [
      "-fsycl-targets=amdgcn-amd-amdhsa",
      "-Xsycl-target-backend=amdgcn-amd-amdhsa",
      "--offload-arch=gfx950"
    ],
    "selector": "hip:0",
    "steps": [
      {
        "step": "reference_build",
        "status": "ok",
        "summary": "exit 0: g++ -O2 -std=c++17 -I/tmp/tmp.MASm2fphen/task /tmp/tmp.MASm2fphen/task/scan_ref.cpp -o build/reference"
      },
      {
        "step": "native_build",
        "status": "ok",
        "summary": "exit 0: /opt/rocm/bin/hipcc -O2 -std=c++17 --offload-arch=gfx950 -I/tmp/tmp.MASm2fphen/task /tmp/tmp.MASm2fphen/out/work/scan.hip.cpp -o build/native"
      },
      {
        "step": "native_verify_vs_reference",
        "status": "ok",
        "summary": "PASS: 1/1 case(s) match (worst max abs err 0, atol 0)"
      },
      {
        "step": "sycl_compile",
        "status": "ok",
        "summary": "compiled 1 source(s) -> /tmp/tmp.MASm2fphen/out/work/build/sycl (20 warning(s))"
      },
      {
        "step": "sycl_verify_vs_reference",
        "status": "ok",
        "summary": "PASS: 1/1 case(s) match (worst max abs err 0, atol 0)"
      },
      {
        "step": "sycl_verify_vs_native",
        "status": "ok",
        "summary": "PASS: 1/1 case(s) match (worst max abs err 0, atol 0)"
      },
      {
        "step": "sycl_benchmark",
        "status": "ok",
        "summary": "10 run(s) each; hip:0: median 320.01 ms, p95 332.76 ms"
      },
      {
        "step": "native_benchmark",
        "status": "ok",
        "summary": "10 run(s) each; none: median 302.10 ms, p95 314.62 ms"
      }
    ],
    "results_dir": "/tmp/tmp.MASm2fphen/out/results"
  },
  "limitations": [
    "Benchmarks are single-process wall times plus program-reported kernel times; treat them as rough."
  ]
}