{
  "tool": "gpu_test",
  "status": "ok",
  "summary": "PASS on NVIDIA RTX 2000 Ada Generation (cuda:0, nvidia): sycl_verify_vs_reference: PASS: 1/1 case(s) match (worst max abs err 9.69e-08, atol 1e-06); sycl_verify_vs_native: PASS: 1/1 case(s) match (worst max abs err 7.45e-09, atol 1e-06)",
  "evidence": {
    "task": "softmax_hecbench",
    "device": {
      "backend": "cuda",
      "device_type": "gpu",
      "index": 0,
      "platform": "NVIDIA CUDA BACKEND",
      "name": "NVIDIA RTX 2000 Ada Generation",
      "description": "NVIDIA CUDA BACKEND, NVIDIA RTX 2000 Ada Generation 8.9 [CUDA 13.0]",
      "selector": "cuda:0"
    },
    "vendor": "nvidia",
    "amd_arch": null,
    "target_flags": [
      "-fsycl-targets=nvptx64-nvidia-cuda"
    ],
    "selector": "cuda:0",
    "steps": [
      {
        "step": "reference_build",
        "status": "ok",
        "summary": "exit 0: g++ -O2 -std=c++17 -I/tmp/tmp.avma5wL9W1/task /tmp/tmp.avma5wL9W1/task/softmax_ref.cpp -o build/reference"
      },
      {
        "step": "native_build",
        "status": "ok",
        "summary": "exit 0: /usr/local/cuda/bin/nvcc -O2 -std=c++17 -arch=native -I/tmp/tmp.avma5wL9W1/task /tmp/tmp.avma5wL9W1/task/softmax.cu -o build/native"
      },
      {
        "step": "native_verify_vs_reference",
        "status": "ok",
        "summary": "PASS: 1/1 case(s) match (worst max abs err 9.69e-08, atol 1e-06)"
      },
      {
        "step": "sycl_compile",
        "status": "ok",
        "summary": "compiled 1 source(s) -> /tmp/tmp.avma5wL9W1/out/work/build/sycl (0 warning(s))"
      },
      {
        "step": "sycl_verify_vs_reference",
        "status": "ok",
        "summary": "PASS: 1/1 case(s) match (worst max abs err 9.69e-08, atol 1e-06)"
      },
      {
        "step": "sycl_verify_vs_native",
        "status": "ok",
        "summary": "PASS: 1/1 case(s) match (worst max abs err 7.45e-09, atol 1e-06)"
      },
      {
        "step": "sycl_benchmark",
        "status": "ok",
        "summary": "10 run(s) each; cuda:0: median 367.70 ms, p95 2068.95 ms"
      },
      {
        "step": "native_benchmark",
        "status": "ok",
        "summary": "10 run(s) each; none: median 317.49 ms, p95 841.38 ms"
      }
    ],
    "results_dir": "/tmp/tmp.avma5wL9W1/out/results"
  },
  "limitations": [
    "Benchmarks are single-process wall times plus program-reported kernel times; treat them as rough."
  ]
}