{
  "tool": "compile",
  "status": "ok",
  "summary": "compiled 1 source(s) -> /tmp/tmp.s2UTLv4Bj4/out/work/build/sycl (0 warning(s))",
  "evidence": {
    "run": {
      "command": "/opt/sycl/bin/clang++ -fsycl -O2 -fsycl-targets=nvidia_gpu_sm_89 -I/tmp/tmp.s2UTLv4Bj4/task /tmp/tmp.s2UTLv4Bj4/task/sycl/softmax.cpp -o /tmp/tmp.s2UTLv4Bj4/out/work/build/sycl",
      "returncode": 0,
      "duration_s": 8.241412,
      "stdout": "",
      "stderr": ""
    },
    "output": "/tmp/tmp.s2UTLv4Bj4/out/work/build/sycl",
    "dpct_include_added": null,
    "diagnostics": [],
    "counts": {
      "error": 0,
      "warning": 0,
      "note": 0
    }
  },
  "limitations": [
    "A successful compile says nothing about numerical correctness; run verify."
  ]
}