{
  "tool": "verify",
  "status": "ok",
  "summary": "PASS: 1/1 case(s) match (worst max abs err 0, atol 0)",
  "evidence": {
    "mode": "array",
    "cases": [
      {
        "input": null,
        "reference": {
          "command": "build/native /tmp/tmp.LfgnhhDKaX/out/work/v_sycl_native/case0_reference.out 1048576",
          "returncode": 0,
          "duration_s": 0.160809,
          "stdout": "kernel_ms=0.368420\n",
          "stderr": "",
          "cwd": "/tmp/tmp.LfgnhhDKaX/out/work",
          "env_overrides": {
            "ONEAPI_DEVICE_SELECTOR": "hip:0"
          },
          "output_file": "/tmp/tmp.LfgnhhDKaX/out/work/v_sycl_native/case0_reference.out"
        },
        "candidate": {
          "command": "build/sycl /tmp/tmp.LfgnhhDKaX/out/work/v_sycl_native/case0_candidate.out 1048576",
          "returncode": 0,
          "duration_s": 0.197787,
          "stdout": "kernel_ms=6.123048\n",
          "stderr": "",
          "cwd": "/tmp/tmp.LfgnhhDKaX/out/work",
          "env_overrides": {
            "ONEAPI_DEVICE_SELECTOR": "hip:0"
          },
          "output_file": "/tmp/tmp.LfgnhhDKaX/out/work/v_sycl_native/case0_candidate.out"
        },
        "reference_format": "f64",
        "candidate_format": "f64",
        "mode": "array",
        "stats": {
          "n_reference": 1048576,
          "n_candidate": 1048576,
          "atol": 0.0,
          "rtol": 0.0,
          "max_ulp_allowed": null,
          "passed": true,
          "max_abs_err": 0.0,
          "rms_err": 0.0,
          "mean_abs_err": 0.0,
          "max_rel_err": 0.0,
          "max_ulp_f32": 0,
          "median_ulp_f32": 0.0,
          "exact_matches": 1048576,
          "mismatches": 0,
          "nan_mismatches": 0,
          "reference_range": [
            28.0,
            15728625.0
          ],
          "first_mismatches": []
        },
        "passed": true
      }
    ],
    "work_dir": "/tmp/tmp.LfgnhhDKaX/out/work/v_sycl_native",
    "passed_cases": 1,
    "total_cases": 1,
    "worst_max_abs_err": 0.0
  },
  "limitations": [
    "Equivalence is shown only for the inputs tested; other inputs/sizes may behave differently."
  ]
}