{
  "tool": "gpu_test",
  "status": "ok",
  "summary": "PASS on NVIDIA RTX A4000 (cuda:0, nvidia): sycl_verify_vs_reference: PASS: 1/1 case(s) match (worst max abs err 0, atol 0); sycl_verify_vs_native: PASS: 1/1 case(s) match (worst max abs err 0, atol 0)",
  "evidence": {
    "task": "atomic_reduction_hecbench",
    "device": {
      "backend": "cuda",
      "device_type": "gpu",
      "index": 0,
      "platform": "NVIDIA CUDA BACKEND",
      "name": "NVIDIA RTX A4000",
      "description": "NVIDIA CUDA BACKEND, NVIDIA RTX A4000 8.6 [CUDA 13.2]",
      "selector": "cuda:0"
    },
    "vendor": "nvidia",
    "amd_arch": null,
    "cuda_arch": "86",
    "target_flags": [
      "-fsycl-targets=nvidia_gpu_sm_86"
    ],
    "selector": "cuda:0",
    "steps": [
      {
        "step": "reference_build",
        "status": "ok",
        "summary": "exit 0: g++ -O2 -std=c++17 -I/tmp/tmp.hDen6y2MzL/task /tmp/tmp.hDen6y2MzL/task/reduction_ref.cpp -o build/reference"
      },
      {
        "step": "native_build",
        "status": "ok",
        "summary": "exit 0: /usr/local/cuda/bin/nvcc -O2 -std=c++17 -arch=native -I/tmp/tmp.hDen6y2MzL/task /tmp/tmp.hDen6y2MzL/task/reduction.cu -o build/native"
      },
      {
        "step": "native_verify_vs_reference",
        "status": "ok",
        "summary": "PASS: 1/1 case(s) match (worst max abs err 0, atol 0)"
      },
      {
        "step": "sycl_compile",
        "status": "ok",
        "summary": "compiled 1 source(s) -> /tmp/tmp.hDen6y2MzL/out/work/build/sycl (0 warning(s))"
      },
      {
        "step": "sycl_verify_vs_reference",
        "status": "ok",
        "summary": "PASS: 1/1 case(s) match (worst max abs err 0, atol 0)"
      },
      {
        "step": "sycl_verify_vs_native",
        "status": "ok",
        "summary": "PASS: 1/1 case(s) match (worst max abs err 0, atol 0)"
      },
      {
        "step": "sycl_benchmark",
        "status": "ok",
        "summary": "10 run(s) each; cuda:0: median 490.30 ms, p95 693.12 ms"
      },
      {
        "step": "native_benchmark",
        "status": "ok",
        "summary": "10 run(s) each; none: median 502.37 ms, p95 563.35 ms"
      }
    ],
    "results_dir": "/tmp/tmp.hDen6y2MzL/out/results"
  },
  "limitations": [
    "Benchmarks are single-process wall times plus program-reported kernel times; treat them as rough."
  ]
}