{
  "tool": "compile",
  "status": "ok",
  "summary": "compiled 1 source(s) -> /tmp/tmp.B3ftncYlWn/out/work/build/sycl (0 warning(s))",
  "evidence": {
    "run": {
      "command": "/opt/sycl/bin/clang++ -fsycl -O2 -fsycl-targets=amdgcn-amd-amdhsa -Xsycl-target-backend=amdgcn-amd-amdhsa --offload-arch=gfx950 -I/tmp/tmp.B3ftncYlWn/task /tmp/tmp.B3ftncYlWn/task/agent_port/migrated/reduction.dp.cpp -o /tmp/tmp.B3ftncYlWn/out/work/build/sycl",
      "returncode": 0,
      "duration_s": 2.764008,
      "stdout": "",
      "stderr": ""
    },
    "output": "/tmp/tmp.B3ftncYlWn/out/work/build/sycl",
    "dpct_include_added": null,
    "diagnostics": [],
    "counts": {
      "error": 0,
      "warning": 0,
      "note": 0
    }
  },
  "limitations": [
    "A successful compile says nothing about numerical correctness; run verify."
  ]
}